id,name
284699,Aro Printed Tissue Napkin Institutional Pack 100 (Pack Of 4) 1Ply
291046,Cycle Three In One Agarbatti 132G
271379,"Dheepam Lamp Oil, 1L Pet Bottle"
393204,Glade Touch & Fresh Refill Fresh Lemon-2 + Wild Lavender-1 (12ml each)
268688,Good Knightmaha Jumbo Mosquito Repellent 12 Hours Coil 10+4Pc
354096,Hem Precious Incense Stick Pop-12 Pa Set 180 G
107803,Hit Fresh Fragrance Kills Cockroaches 400 Ml
268761,Odonil Air Freshener Blocks - 50G Buy 3 Get 1 Free
268759,Odonil Air Freshener Blocks 75G Buy3 Get1 Free
