id,name,status,sub_cate_id
5446,pulse,1,40
5447,quaker,1,39
5448,santoor,1,49
5449,skittles,1,40
5450,snickers,1,40
5451,wingreen greek,1,44
5452,wrigleys,1,44
5453,zandu,1,44
5454,tic tac,1,40
5455,tasty pixel,1,44
5456,st dalfour,1,44
5457,soulfull,1,39
5458,soft n silky,1,114
5459,almonds,1,26
5460,pistachios inshell,1,26
5461,pista roasted & salted,1,26
5462,traditional pasta sauce,1,44
5463,american garden us mustard 227g,1,44
5464,amul sugar free dark chocolate 150g,1,40
5465,aro crunchy corn flakes 500g pouch,1,39
5466,aro crunchy corn flakes 875g pouch,1,39
5467,asap toasted grains dark choco 420g,1,39
5468,asap toasted grains badam milk 120g,1,39
5469,asap muesli fruit & 5 toasted grains fruits 120g,1,39
5470,bambino macaroni elbow pasta 1.5 kg,1,41
5471,bambino popular vermicelli 150g,1,41
5472,bambino roasted vermicelli 150g,1,41
5473,bambino seviyan thin 450g,1,41
5474,biskfarm so sweet biscuits 250g,1,38
5475,biskfarm the top butter biscuit 200g,1,38
5476,bambino roasted vermicelli 650g jar,1,41
5477,borges apple cider vinegar 355ml,1,61
5478,britannia 50-50 potazos 100g,1,38
5479,britannia 50-50 potazos 29g*12,1,38
5480,britannia treat burst super value pack 300g,1,38
5481,candyman cofitino 780g jar,1,40
5482,chefs basket durum wheat penne pasta 500g,1,41
5483,ching's chilli vinegar synthetic 170ml,1,61
5484,chings veg hakka noodles 150g,1,41
5485,chings veg hakka noodles 600g,1,41
5486,chings whole wheat hakka noodles 150g,1,41
5487,chings whole wheat hakka noodles 600g,1,41
5488,cremica salad mayonnaise 1kg,1,44
5489,cup noodles rich mutton curry 70g,1,41
5490,cup noodles seafood curry 70g,1,41
5491,dabur hommade mango pickle 400g glass bottle,1,42
5492,dabur hommade mixed pickle 400g glass bottle,1,42
5493,dabur hommade green chilli pickle 400g glass bottle,1,42
5494,del monte baked beans sauce 450g,1,44
5495,del monte eggless mayo 270g,1,44
5496,derby cafetto espresso coffee candy 800g jar,1,40
5497,derby darling velvetto lovedrops 800g jar,1,40
5498,derby center filled candies 200g,1,40
5499,derby love candy assorted fruit flavour 900g jar,1,40
5500,derby wala aam chaskara 900g jar,1,40
5501,derby naranja 800g jar,1,40
5502,derby center filled shocker candi 800g jar,1,40
5503,derby tamarind candy 900g jar,1,40
5504,desi spinach hakka noodles 400g,1,41
5505,dnv mustard kasundi 670g,1,44
5506,dnv vinegar 350ml,1,61
5507,dnv vinegar 670ml,1,61
5508,double horse vinegar 1ltr,1,61
5509,double house cut mango pickle 400g glass bottle,1,42
5510,double house dates pickle 400g glass bottle,1,42
5511,double house hot & sweet lime 400g glass bottle,1,42
5512,double house tender mango pickle 400g glass bottle,1,42
5513,dukes pineapple sandwich biscuit 150g,1,38
5514,fabelle choco deck mini delights 163g,1,40
5515,fine life fusilli pasta 430g,1,41
5516,fine life fusilli pasta 930g,1,41
5517,fine life hakka noodles 450g,1,41
5518,fine life honey 50g,1,44
5519,fine life lemon pickle 200g pouch,1,42
5520,fine life macaroni pasta 430g,1,41
5521,fine life mango pickle 200g pouch,1,42
5522,fine life mixed pickle 200g pouch,1,42
5523,fine life pasta sauce 310g,1,44
5524,fine life penne pasta 500g,1,41
5525,fine life pizza sauce 315g,1,44
5526,fine life soya sauce 700g,1,44
5527,fine life vermicelli roasted 430g,1,41
5528,fun foods pasta & pizza sauce 800g,1,44
5529,fun foods peanut butter creamy 400g,1,44
5530,fun foods peanut butter crunchy 400g,1,44
5531,fun foods pizza topping 100g,1,44
5532,fun foods veg mayonnaise for coleslaw 1kg,1,44
5533,galaxy crispy 18g,1,40
5534,galaxy crispy 32units,1,40
5535,galaxy milk chocolate smooth milk 32units,1,40
5536,galaxy milk chocolate smooth milk 20g,1,40
5537,galaxy milk chocolate smooth milk 56g,1,40
5538,galaxy milk chocolate smooth milk bar 80g,1,40
5539,galaxy milk chocolate with cookie crumble 50g,1,40
5540,galaxy milk chocolate with fruit &nut 52g,1,40
5541,goeld beetroot & cheese tikki 240g,1,103
5542,goeld veg seek kebab 200g,1,103
5543,goeld vegetable spring roll 960g,1,101
5544,gonemad tiramisu sticks 100g,1,38
5545,gonemad choco stick 72g,1,38
5546,gourmet's chocolate wafers 150g,1,38
5547,gourmet's orange wafers 150g,1,38
5548,gourmet's strawberry wafers 150g,1,38
5549,habanero hot sauce 100g,1,44
5550,habanero sriracha chilli sauce 185g,1,44
5551,hershey's almonds guava & mexican chilli flavour 30g,1,40
5552,hershey's californian almonds with blackberry flavour 30g,1,40
5553,hershey's californian almonds with blackberry flavour 90g,1,40
5554,hershey's guava & mexican chilli flavour 90g,1,40
5555,jelimals yummy jelly bears 108g,1,40
5556,kelloggs choco fills 175g,1,39
5557,kelloggs chocos 110g,1,39
5558,kelloggs chocos 250g,1,39
5559,kelloggs chocos 26g pack of 16,1,39
5560,kelloggs chocos chhota laddoo 375g,1,39
5561,kelloggs chocos duet 375g,1,39
5562,kelloggs chocos magic hearts 23g,1,39
5563,kelloggs chocos moons & stars 26g pack of 16,1,39
5564,kelloggs chocos moons & stars 375g,1,39
5565,kelloggs corn flakes original 30g pack of 6,1,39
5566,kelloggs crunchy granola chocolate & almonds 450g,1,39
5567,kelloggs almonds strawberrie 450g,1,39
5568,kelloggs multigrain cereal 285g,1,39
5569,kelloggs oats 200g,1,39
5570,kerk deluxe chocolate sandwich 184g,1,38
5571,kerk deluxe peanut butter sandwich 184g,1,38
5572,keya italiano chifferi rigati pasta 500g,1,41
5573,kissan tomato ketchup 130g rfl,1,44
5574,koka satay chicken noodles 85g,1,41
5575,koka the original chicken flavour 85g,1,41
5576,loacker quadratini cocoa & milk 125g,1,38
5577,loacker quadratini dark chocolate 250g,1,38
5578,loacker quadratini double choc 125g,1,38
5579,loacker quadratini napolitaner 125g,1,38
5580,loacker quadratini napolitaner 250g,1,38
5581,loacker quadratini vanilla 125g,1,38
5582,lotte gum mixed fruit flavored 315g jar,1,40
5583,lotte gum strawberry flavoured 465g jar,1,40
5584,lotte lacto king milk candy 280g pouch,1,40
5585,maggi 2 minutes noodles chicken 65 284g,1,41
5586,maggi 2 minutes noodles special chicken 71g,1,41
5587,maggi cuppa chilly chow noodles 70g,1,41
5588,maggi hot & sweet tomato chilli sauce 200g,1,44
5589,malas froogle fruity chews imli 600g jar,1,40
5590,mars miniatures 90g,1,40
5591,mayora atta bix atta sandwich biscuit 115g,1,38
5592,mccain aloo tikki 1.24kg,1,103
5593,mccain aloo tikki 1.5kg,1,103
5594,mccain chilli garlic potato nuggets 1.5kg,1,103
5595,mccain crinkle fries 9mm 2.5kg,1,103
5596,mccain french fries regular 6mm 2.5kg,1,103
5597,mccain french fries regular 9mm 2.5kg,1,103
5598,mccain masala fries indian spices 1.5kg,1,103
5599,mccain green chutney flavour 1.5kg,1,103
5600,mccain popular vege burger patty 1.2kg,1,103
5601,mccain potato cheese shots 1kg,1,103
5602,mccain classic hashbrown patties 1.5kg,1,103
5603,mccain coated potatoes 2.5kg,1,103
5604,mccain smiles crispy potatoes 1.5kg,1,103
5605,mccain sure crisp 6mm 3kg,1,103
5606,"mccain veggie cron, carrot & peas 1kg",1,103
5607,meal time green chilli sauce 5kg,1,44
5608,meal time red chilli sauce 5kg,1,44
5609,meal time tomato sauce 5kg,1,44
5610,meatzza chicken jumbo nuggets 1kg,1,103
5611,meatzza krispy fried chicken 500g tub,1,103
5612,metro chef chinese sauce combo,1,44
5613,metro chef green chilli sauce 200g,1,44
5614,metro chef red chilli sauce 200g,1,44
5615,metro chef soya sauce 200g,1,44
5616,metro chef tomato ketchup 950g buy1 get1 free,1,44
5617,metro chef vinegar 200g,1,61
5618,milkist cappuccino flavour crackers biscuit 138g,1,38
5619,milkist sugar crackers biscuit 135g,1,38
5620,mint-o gol mint & orange flavour 700g,1,40
5621,mother's recipe cut mango pickle 50g glass bottle,1,42
5622,mother's recipe garlic pickle 300g glass bottle,1,42
5623,mother's recipe mixed pickle 500g pouch,1,42
5624,mother's recipe punjabi mango pickle 400g glass bottle,1,42
5625,mother's recipe chilli pickle 400g glass bottle,1,42
5626,mrs. food rite pizza pasta sauce 275g,1,44
5627,mrs. food rite szechuan chutney 250g,1,44
5628,mtr elbow macaroni 850 g,1,41
5629,mtr rava dosa breakfast 500g,1,39
5630,nando's peri peri sauce lemon & herb 250g,1,44
5631,nando's peri peri sauce medium 250g,1,44
5632,nando's peri peri xx hot sauce 125g,1,44
5633,nestle kitkat 4 fingers 766.5g,1,40
5634,nestle munch 800g,1,40
5635,nestle munch nuts 24units 768g,1,40
5636,nestle munch nuts yumm 15units 240g,1,40
5637,oateo instant oats marvel avengers 1.5kg,1,39
5638,oateo instant oats marvel avengers 1kg,1,39
5639,oateo instant oats marvel avengers 400g,1,39
5640,orion custas cup cake 6units 138g,1,40
5641,orion o'rice cracker 151.2g,1,38
5642,parle nutricrunch ginger skap cookies 100g,1,38
5643,pintola peanut butter creamy 350g,1,44
5644,pintola peanut butter chocolate creamy 350g,1,44
5645,pran potata spicy biscuit 100g,1,38
5646,pulse guava pineapple 680g jar,1,40
5647,pure heart nut spread chico almond 192g,1,44
5648,pure heart nut spread choco cashew192g,1,44
5649,pure heart nut spread creamy cashew 192g,1,44
5650,quaker oats with flavour mix 200g,1,39
5651,real thai green curry padta 50g,1,44
5652,real thai green curry pasta 1kg,1,44
5653,real thai red curry pasta 1kg,1,44
5654,real thai red curry paste 50g,1,44
5655,ruchi lime pickle 7g 50pk,1,42
5656,safal frozen green peas 5kg,1,103
5657,saffola honey no added sugar 1kg,1,44
5658,saffola honey no added sugar 250g,1,44
5659,saffola honey no added sugar 500g,1,44
5660,skittles clear candy 5 assorted flavors 412.5g,1,40
5661,skittles wild berry 12units 348g,1,40
5662,snickers 12x family treats 12units-168g,1,40
5663,snickers home pack 6units-240g,1,40
5664,soulfull choco fills ragi bites 50g,1,39
5665,soulfull ragi bites no maida choco 375g,1,39
5666,st dalfour cranberry & blueberry spread 284g,1,44
5667,st dalfour four fruit spread 284g,1,44
5668,sundrop cocoa nut almond chocolatey spread 160g,1,44
5669,sundrop cocoa nut hazelnut chocolatey spread 350g,1,44
5670,sundrop duo coconut bar 23.5g,1,40
5671,sundrop duo coconut pralines 171.6g,1,40
5672,sundrop duo coconut pralines 85.8g,1,40
5673,sunfeast chatpata masala biscuits 32.9g,1,38
5674,sunfeast chatpata masala biscuits 75g,1,38
5675,sunfeast farmlite 5 seed digestive 250g,1,38
5676,sunfeast farmlite 5seed digestive 100g,1,38
5677,sunfeast nuts digestive almond & cashews 100g,1,38
5678,sunfeast nuts digestive almond & cashews 250g,1,38
5679,sunfeast veda digestive 100g,1,38
5680,sunfeast veda digestive 250g,1,38
5681,sunfeast yippee noodles magic masala 540g,1,41
5682,sunfeast yippee noodles saucy masala 67.5g,1,41
5683,tasty pixel snack dressing 1.2kg jar,1,44
5684,tasty pixel snack dressing 1.2kg pack,1,44
5685,tic tac orange 116.4g jar,1,40
5686,tic tac red apple 46.2g,1,40
5687,tic tac seeds elaichi & ginger 46.2g,1,40
5688,top ramen chicken noodles 280g,1,41
5689,unibic snappers potato crackers cream n onion 75g,1,38
5690,unibic snappers potato crackers indi spice 75g,1,38
5691,veeba cheesy spread & dressing 450g,1,44
5692,veeba food services white cheese dressing 1kg,1,44
5693,veeba hot sweet tomato chilli sauce 500g,1,44
5694,veeba tomato ketchup 8g*100,1,44
5695,veeba tomato ketchup chef's special 950g,1,44
5696,veeba truly tomato ketchup 1kg,1,44
5697,veeba truly tomato ketchup 500g,1,44
5698,veeba truly tomato ketchup 900g,1,44
5699,weikfield instant pasta masala twist 77g,1,41
5700,weikfield instant pasta tomato salsa 77g,1,41
5701,weikfield pasta elbow 400g,1,41
5702,weikfield pasta fusilli 400g,1,41
5703,weikfield pasta macaroni 900g,1,41
5704,weikfield pasta penne 400g,1,41
5705,wingreen basil hummus 150g,1,44
5706,wingreen dip & spread sour cream and onion 150g,1,44
5707,wingreen greek goddess dip & spred chilli cheese 150g,1,44
5708,wingreen greek goddess dip & spred mint cucumber 150g,1,44
5709,wingreen original recipe italian herb mayo 450g,1,44
5710,wingreens original recipe premium veg mayo 450g,1,44
5711,wrigleys boomer jelly 600g jar,1,40
5712,wrigleys doublement mints 76g,1,40
5713,wrigleys doublemint chewy mints 33.6g,1,40
5714,wrigleys doublemint chewy mints strawberry flavour 33.5g,1,40
5715,wrigleys doublmint ice brust 412.5g jar,1,40
5716,wrigleys orbit raw mango flavour 140.8g,1,40
5717,wrigleys orbit sugar free mixed fruit flavour 66g,1,40
5718,wrigleys orbit sugar free raw mango flavour 22g,1,40
5719,wrigleys orbit sugar free spearmint flavour 66g,1,40
5720,wrigleys orbit sugar free strawberry flavour 32units-140.8g,1,40
5721,yoga bar muesli almond quinoa crunch 400g,1,39
5722,yoga bar oats dark chocolate 400g,1,39
5723,yoga bar oats veggies masala 400g,1,39
5724,zandu pure honey 400g buy1 get1 free,1,44
5725,chocos,1,39
