id,name,descriptions
269133,"MDH Amchoor Powder, 100 g Pouch",amchoor powder or dry mango powder is usually used to add sour or tangy flavor to dishes. It is a fruity spice powder made from unripe mangoes and adds refreshing flavour to the recipe.
269268,MDH Kashmiri Mirch Powder 100 G,"Kashmiri Chilli powder adds vibrant red colour and balanced flavour to the dishes.
  This is one spice that is a must in tandoori dishes and fish curries"
269286,"MDH Dhania Powder, 100g","Coriander seeds are packed with key nutrients like vitamin C
 folic acid, vitamin A and beta-carotene.They aid production of
 digestive hormones, promotes liver health and reduces bad cholesterol."
270518,"MDH White Pepper Powder, 100 g",Both Black Pepper and white pepper are from the same plant.The difference is in the processing.Pepper contains plenty of antioxidants that promotes numerous health benefits
271130,"Everest Cumin Powder, 100 g Carton","Jeera or Cumin is a rich source of potassium and iron which promotes immune health. 
 It contains incredible source of antioxidants ,prevents cancer ,cures diarrhea and regulates blood sugar · It is antibacterial and fights parasites."
271156,Guntur Stemless Chilli / Mirchi Whole 1 Kg,"Guntur dry Chilli has vibrant red color and hot flavour and is the most popular chilli in South India. 
 It is spicy and a hot variety of chilli."
271680,Winny Kabab Masala Powder 100 g,"Kabab masala powder is a perfect blend of spices which are used to marinate lamb, chicken or fish before preparing kebabs.It will help you to save your time in kabab making."
275242,"Aashirvaad Chilli Powder /Mirchi , 100 g","Red Chillies are good source of Vitamin C that improves
  immune health and fights chronic diseases. It promotes heart
 health and contains antioxidants in red chilli that aids in 
 preventing blockages in blood vessels and arteries."
278285,Everest Sambar Masala Powder 50 g,"Sambhar masala is a mix of spices in certain proportions.It is an important spice mix 
  in sambar recipe as well as many other recipes ."
279801,"24 Mantra Organic Turmeric Powder, 100 g","Organic Turmeric has too many proven health benefits -It adds natural glow to your skin,
  improves immunity,heart health, prevents Alzheimer's disease and cancer. It' is anti-inflammatory and antioxidant. It may also helps to fight depression and arthritis."
279813,"24 Mantra Organic Red Stick Chilly, 100 g","Organic Red Stick Chilly prevents ulcers, promotes heart health and immunity.
 It gives natural red color to food and is spicy.It is usually preferred in the preparation
 of non-veg dishes and pickles."
279815,24 Mantra Organic Tamarind 500g,"Tamarind is rich in vital compounds, minerals, vitamins,iron antioxidants and dietary fibre.
 The Key Health Benefits Organic tamarind includes improving digestive and immune health.It gives natural glow to skin
 and adds volume and shine to hair.It controls cholesterol and and promotes blood circulation."
279817,"24 Mantra Organic Fenugreek Seeds Organic whole /Methi seeds whole, 100 g","Fenugreek is a unique herb that has also been used as a medicine.It reduces inflammation,aids in blood sugar control,weight loss,pain relief and improves fertility.It also improves heart health and stabilizes blood pressure condition."
279819,"24 Mantra Organic Mustard Seed whole, Small, 100 g","Mustard seeds contain minerals that strengthen your bones ,nails,hair and teeth. The abundant presence of 
  antioxidants and anti-inflammatory properties relieves pain in the teeth,gum and bones."
279822,"24 Mantra Organic Mustard Seed, Big, 100 g","Mustard seeds contain minerals that strengthen your bones ,nails,hair and teeth. The abundant presence of 
  antioxidants and anti-inflammatory properties relieves pain in the teeth,gum and bones."
279856,"24 Mantra Organic Black Pepper, 100 g","Organic Pepper contains plenty of antioxidants that promotes health benefits like anti-inflammatory , 
 antibacterial and cancer fighting properties.It boosts brain function,checks blood sugar and 
 aids digestive health."
279857,"24 Mantra Organic Chilli Powder, 100 g","Organic Chillies are good source of Vitamin C that improves
  immune health and fights chronic diseases. It promotes heart
 health and contains antioxidants in red chilli that aids in 
 preventing blockages in blood vessels and arteries."
279859,"24 Mantra Organic Cloves, 50 g","Cloves are incredible source of antioxidants that promotes immune health 
 and enables your body to fight elements that damage the cells and cause diseases"
279860,"24 Mantra Organic Coriander Powder, 100 g","Organic Coriander powder are packed with key nutrients like vitamin C
 folic acid, vitamin A and beta-carotene.They aid production of
 digestive hormones, promotes liver health and reduces bad cholesterol."
279863,"24 Mantra Organic Coriander Seeds - Whole, 100 g",Grown without synthetic Pesticides
279864,"24 Mantra Organic Cumin Seed, 100 g","Cumin seed is a rich source of potassium and iron which promotes immune health. 
 It contains incredible source of antioxidants ,prevents cancer ,cures diarrhea and regulates 
  blood sugar · It is antibacterial and fights parasites."
279866,"24 Mantra Organic Fennel Seed Organic/saunf,100g",Fennel seeds are good source of fibre and potassium .It aid weight loss improves metabolism and maintains proper appetite . They promote heart health and kidney functioning .
279867,"24 Mantra Organic Ajwain, 100g","Active enzymes in ajwain improve the flow of stomach acids, which can help to relieve indigestion, bloating, and gas."
280677,"MTR Powder - Brinjal Rice/Vangi Bath, 200 g Pouch","Vangi bath powder is a unique blend of spices in definite proportion and combination to flavour
  sumptuous traditional meal of brinjal and rice."
282197,Everest King Masala Powder 50 g,"Kitchen king masala is a blend of authentic spices in certain combination and proportions.It gives your dishes a new flavor and it is convenient to use
 in recipes"
223536,Sugar Free Natura Sachet - 0.75 g (Pack of 100),Sugar free Natura has very less or no calories though it tastes exactly like that of sugar but contains less food energy than sugar-based sweeteners.
223537,Sugar Free Gold Pellets (100 Pellets),"Sugar free is just right for those with a sweet tooth but are calorie conscious
 or cannot consume direct sugar for medical reasons."
223660,Sugar Free Natura Sweetener - 50 sachets,"Sugar Free Natura Sweetener provides a sweet taste like that of sugar,but contains less energy making it low or zero calorie."
223661,Sugarfree Natura Low Calorie Sweetner - 100 Sachet,Sugarfree Natura Low Calorie Sweetener has very less or no calories and it tastes exactly like sugar.It contains less food energy than other sugar-based sweeteners.
223662,Sugar Free Natura 85 mg - 100 Pellets,Sugar free Natura is a table top sweetener that has very less or no calories and it tastes exactly like sugar.It contains less food energy than other sugar-based sweeteners.
223663,Sugar Free Natura Pellets (200 Pellets),"Sugar free natura is just right for those with a sweet tooth but are calorie conscious
 or cannot intake direct sugar for medical reasons."
236834,"Aashirvaad Salt, 1kg","Aashirvad Salt is made from Pure and natural Sea salt crystals. 
 The body balances fluids in the blood with the help of salt.This is vital to
 stabilize blood pressure as well as proper functioning of nerves and muscle"
241598,"Tata Salt, 1Kg (Pack of 50)",Tata Salt is vaccum evaporated and iodised Salt which is an important nutrient required for the mental development.
241600,Tata Salt 1 kg,Tata Salt contains Iodine which is key nutrient to mental growth and development.
241601,Tata Salt Lite 1 kg,Tata Salt Lite contains iodine with 15 % less sodium which is light on stomach to assist better health and balanced taste
242596,Sugarfree Natura Low Calorie Sweetner - 300 Pellets,Sugarfree Natura Low Calorie Sweetener has very less or no calories and it tastes exactly like sugar.It contains less food energy than other sugar-based sweeteners.
244096,"Madhur Pure and Hygienic Sugar, 1kg Bag",Sugar provides energy required for the effective functioning of the body and
248003,"Akar Iodised Crystal salt, 1kg","The body balances fluids in the blood with the help of salt.Iodized Salt is vital to
 stabilize blood pressure as well as proper functioning of nerves and muscles"
266592,"Catch Sprinklers Iodized Table Salt, 200 g",Catch Sprinklers Iodized Table Salt is a table top salt sprinkler easy to use and handy
279803,"24 Mantra Organic Jaggery Powder, 500 g","Jaggery flushes toxins from the body It is loaded 
 with antioxidants and minerals that retains youthful looks.
 It also builds stronger immunity"
279807,"24 Mantra Organic Sulphurless Sugar, 500 g","Sugar provide energy required for the effective functioning of the body and 
 also for later activities.It boosts your mood and improve thinking ability."
298778,Sugarfree Gold Low Calorie Sweetner - 500 Pellets,Sugarfree Gold Low Calorie Sweetener has very less or no calories and it tastes exactly like sugar.It contains less food energy than other sugar-based sweeteners.
298943,"Sugar Free Natura Powder, 100 g","Sugar free natura is just right for those with a sweet tooth but are calorie conscious
 or cannot intake direct sugar for medical reasons."
298951,Sugarfree Natura Low Calorie Sweetner - 80 g Jar,Sugarfree Natura Low Calorie Sweetener has very less or no calories and it tastes exactly like sugar.It contains less food energy than other sugar-based sweeteners.
332227,"On1y Salt Grinder, 100 g","Salt grinder grinds large crystal sea salts so that 
 you can easily sprinkle them over the food. It also adds quantity to the salt."
332229,"On1y Pink Salt Grinder, 100 g","Himalayan Pink Salt grinder grinds large crystal Himalayan Pink salts so that 
 you can easily sprinkle them over the food. Pink Salt stabilizes Blood Pressure."
337906,"24 Mantra Organic Sugar, 1kg","Sugar provide energy required for the effective functioning of the body and 
 also for later activities.It boosts your mood and improve thinking ability."
337910,"24 Mantra Organic Sulphurless Sugar, 1kg","Eco friendly sulphurless sugar is safe and healthier and provides energy required for the effective functioning of the body and 
 also for later activities.It boosts your mood and improve thinking ability."
342227,"Pro Nature 100% Organic Sugar, Brown, 500 g","Brown sugar has certain minerals like calcium,iron,magnesium and potassium
  due to its molasses content which makes it a better option than white sugar"
367008,Sugarfree Natura Low Calorie Sweetner 10 ml Bottle,"Sugar free natura sweet drops is the right choice when you are on the go .Easy to carry !Light on calories !
 Have it when you cannot intake direct sugar for medical reasons."
372208,Kolhu Natural Gur (Jaggery) 400g,"Gur or Jaggery flushes toxins from the body It is loaded 
 with antioxidants and minerals that retains youthful looks.
 It also builds stronger immunity"
378375,"Organic Tattva Natural Rock Salt, 500g","Rock Salt has many health benefits and is vital to
 stabilize blood pressure as well as proper functioning of nerves and muscles"
380138,"Pro Nature 100% Organic Jaggery Powder, 400 g","Organic Jaggery promotes liver health by flushing out toxins from the body. It is loaded 
 with antioxidants and minerals that retains youthful looks.It also builds stronger immunity"
384242,"24 Mantra Organic Demerara Sugar Organic, 500 g","Demerara Sugar or Bura sugar is a healthy choice as it does not contain non nutritious or empty calories 
  and chemicals present white sugar"
384277,"24 Mantra Himalayan Rock Salt, 1kg","Himalayan Rock Salt has many health benefits .It helps achieve healthy sodium level which is vital to
 stabilize blood pressure as well as proper functioning of nerves and muscles"
390350,"Puro Healthy Salt, 1 Kg","Puro Healthy Salt is made from Pure and natural Sea salt crystals. 
 Salt intake helps the body balance fluids in the blood which aids to
 stabilize blood pressure and proper functioning of nerves and muscle"
390351,"Puro Healthy Salt Crystal, 1 kg","Puro Healthy Crystal Salt is from Pure and natural Sea salt crystals. Crystal Salt intake promotes healthy thyroid,helps to stabilize blood pressure and proper functioning of nerves and muscle"
393329,"Pro Nature Himalayan Pink Salt - Crystals, 500 g","Himalayan Pink Salt has many health benefits .It helps achieve healthy sodium level which is vital to
 stabilize blood pressure as well as proper functioning of respiratory system,nerves and muscles"
398711,Parry White Label Sugar - 1 kg Pouch,"Sugar provide energy required for the effective functioning of the body and 
 also for later activities.It boosts your mood and improve thinking ability."
398712,Parry White Label Sugar - 5 kg,"Sugar provide energy required for the effective functioning of the body and 
 also for later activities.It boosts your mood and improve thinking ability."
402733,"Pro Nature Classic Himalayan Pink Salt Crystals, 500 g","Himalayan Pink Salt crystals has many health benefits .It helps achieve healthy sodium level which is vital to
 stabilize blood pressure as well as proper functioning of respiratory system,nerves and muscles"
404156,Bucket Jaggery 500,"Jaggery promotes liver health by flushing out toxins from the body. It is loaded 
 with antioxidants and minerals that retains youthful looks.It also builds stronger immunity"
404157,Pellet Jaggery 400 g,"Jaggery flushes toxins from the body It is loaded 
 with antioxidants and minerals that retains youthful looks.
 It also builds stronger immunity."
409195,Fine Life Free Flow Salt 1 kg,
SB0011,Sugar Loose,Sugar provides energy required for the effective functioning of the body and
169054,Sampurna Bazaar Super Thin Poha / Aval 500 g,"It is a good source of carbohydrates, packed with iron, rich in fibre, a good source of antioxidants and essential vitamins and is gluten free. It is known to be good for those who have diabetes, skin and heart problem"
169055,Sri Bhagyalakshmi Thick Rice Flakes 500 g,"Rice Flakes or Aval is a rich source of antioxidants,essential Vitaminsand other nutrients required 
 by our body.It is also gluten free and is ideal for those with 
  lifestyle diseases and health problems."
214217,"Daawat Basmati Rice - Devaaya, 5kg Bag","This long and slender basmati rice gives out a pleasant aroma , delicious taste and distinct flavor 
 It makes the meals from ordinary to extraordinary."
243335,INDIA GATE Super Premium Basmati Rice 1 kg,"The long and slender basmati rice on cooking becomes soft and fluffy texture
  and gives out a pleasant aroma , delicious taste and distinct flavor."
243336,"India Gate Basmati Rice Pouch, Classic, 1kg","The long and slender basmati rice on cooking gives a delicious taste and distinct flavour
  taking the meals to a special level."
247282,"Daawat Traditional Basmati Rice, 1kg","The long and slender basmati rice becomes soft and fluffy on cooking and gives a delicious and distinct flavour
  making the meals extraordinary."
255843,Daawat Super Basmati Rice 5kg,"The long and slender basmati rice becomes soft and fluffy on cooking and gives a delicious and distinct flavour
  making the meals from ordinary to extraordinary."
255848,"Daawat Rozana Super Basmati Rice, 1kg","This long and slender basmati rice gives out a pleasant aroma , delicious taste and distinct flavor 
 It makes the meals from ordinary to extraordinary."
255849,"Daawat Rozana Gold Basmati Rice, 1Kg","The long and slender basmati rice on cooking gives a delicious taste and distinct flavour
  taking the meals to a special level."
255850,"Daawat Biryani Basmati Rice, 1kg","The long and slender basmati rice becomes soft and fluffy and gives a delicious taste and distinct flavour
 making the biryani extraordinary."
255851,"Daawat Basmati Rice - Devaaya, 1kg","The long and slender basmati rice becomes soft and fluffy and gives a delicious taste and distinct flavour
 making the biryani extraordinary."
269800,Double Horse Aval Thick - 500 g,"Aval is a rich source of antioxidants,essential Vitaminsand other nutrients required 
 by our body.It is also gluten free and is ideal for those with 
  lifestyle diseases and health problems."
269801,Avalakki White Pouch 500 g,Aval is an a healthy option as they are devoid of fat and lactose and promotes heart and overall health.
271073,"Daawat Biryani Basmati Rice, 5kg","The long and slender basmati rice becomes soft and fluffy and gives a delicious taste and distinct flavour
 making the biryani extraordinary."
275627,Kesar gold Kolam Rice 10 kg,"Kolam Rice is good for everyday meals, and goes well with curry
 or even as dal khichdi. It is low on glycemic index, thus making it ideal for those with diabetes ."
279831,"24 Mantra Organic Poha (Flattened Rice/Atukulu), 500 g",Aval is an a healthy option as they are devoid of fat and lactose and promotes heart and overall health.
279836,"24 Mantra Organic Sonamasuri Raw Rice Polished, 1kg","Sonamasoori is comparitively low in calorie than long-grain or Basmati rice. It is also easy on digestive system
  and aids weight loss"
279837,"24 Mantra Organic - Sonamasuri Semi Brown Hand Pounded Rice, 1 kg","Sonamasoori Semi Brown hand pound rice is comparitively low in calorie and loaded with nutrients. It is also easy on digestive system
  and aids weight loss"
279838,"24 Mantra Organic Sonamasuri Brown Rice, 1kg","Sonamasoori Brown rice is comparitively better choice for your health than 
  white rice as it decreases the risk of lifestyle diseases."
279833,"24 Mantra Organic Sonamasuri Brown Raw Rice, 5kg","Sonamasoori Brown raw rice is comparitively better choice for your health than 
  white raw rice as it decreases the risk of lifestyle diseases."
280154,"India Gate Basmati Rice Dubar, 1kg","Basmati rice on cooking becomes soft and fluffy texture
  and gives out a pleasant aroma and delicious taste and distinct flavor"
293304,Fine Food Sago 500g,"Sago is extracted from tropical palms, It’s versatile and a primary source of carbs in some parts of the world."
300440,Daawat Super Basmati Rice 1kg,"The Super basmati rice gives out a pleasant aroma and delicious taste and distinct flavor 
 It makes the meals from ordinary to extraordinary."
300441,"Daawat Rozana Super Basmati Rice, 5kg","This Super basmati rice gives out a pleasant aroma , delicious taste and distinct flavor 
 It makes the meals from ordinary to extraordinary."
301278,"Daawat Pulav Basmati Rice, 1kg","This long and slender basmati rice on cooking becomes soft and fluffy texture
  and gives out a pleasant aroma and distinct flavor 
 It makes the pulav taste extraordinary."
301970,"24 Mantra Organic Red Poha (Flattened Rice), 500 g","Red Poha/Flattened Rice is a rich source of iron,antioxidants,essential Vitaminsand other nutrients required 
 by our body.It is also gluten free and is ideal for those with 
  lifestyle diseases and health problems."
308609,"Daawat Brown Basmati Rice, 1kg Jar","Brown basmati is comparitively better choice for your health than
  white basmati rice as it decreases the risk of lifestyle diseases."
320453,"Pro Nature Organic Beaten Rice Poha Thin, 500 g","Organic Beaten Rice or Poha is a healthy choice as they are 100% natural and Pesticide free.Poha is devoid of fat and lactose and promotes heart health.
 It is an ideal choice for those who are allergic to wheat products as it is gluten free."
321594,Aro Thick Poha 1 kg,"Poha is a rich source of antioxidants,essential Vitaminsand other nutrients required 
 by our body.It is also gluten free and is ideal for those with lifestyle diseases and health problems."
336320,"24 Mantra Organic Sonamasuri Raw Rice Polished, 10kg","Sonamasoori raw rice polished is comparitively low in calorie than
 long-grain or Basmati rice. It is also easy on digestive system
  and aids weight loss"
337072,"Daawat Dubar Basmati Rice(Old), 1kg","The Old basmati rice on cooking becomes soft and fluffy texture
  and gives out a pleasant aroma and delicious taste and distinct flavor 
 making the meals from ordinary to extraordinary."
339013,"24 Mantra Organic Ancient Grains - Little Millet, 500 g Carton","Little millet is a good source of magnesium
 which promotes heart health.The presence of Vitamin B3 (niacin) 
in little millet  lowers cholesterol. 
Little millet is incredible source of phosphorus which 
aids in  fat metabolism, body tissue repair and boosts energy"
346443,Fortune Everyday Basmati Rice 1 kg,The Everyday basmati rice becomes soft and fluffy when cooked .It gives out pleasing aroma and and distinct flavor making the meal delicious and tasty.
346447,Fortune Rozana Basmati Rice 5 kg,The Rozana basmati rice turns soft and fluffy when cooked .It gives out pleasing aroma and and distinct flavor making the everyday meal delicious and tasty.
346515,Kiran Gold Sona Masoori Raw Rice -10 kg,"Sonamasoori is comparitively low in calorie than
 long-grain or Basmati rice. It is also easy on digestive system
  and aids weight loss."
351202,"GTS Original Bullet Kolam Raw Rice, 10kg","Bullet Kolam Rice is good for everyday meals, and goes well with curry
 or even as dal khichdi. It is low on glycemic index, thus making it ideal for those with diabetes ."
380134,Pro Nature 100% Organic Red Beaten Rice ( RedPoha ) 500 g,"Red Beaten Rice/Red Poha is a rich source of iron,antioxidants,essential Vitaminsand other nutrients required 
 by our body.It is also gluten free and is ideal for those with lifestyle diseases and health problems."
380153,"Pro Nature 100% Organic Puffed Rice, 200 g","Puffed Rice is an incredible source of fibre, protein and carbohydrates. It is low in calories but
  high in vitamins and minerals.You can make a healthy and energetic snack combining it with tomato, cucumber 
 and mint chutney."
387347,Zeeba Extra Long Premium Basmati Rice 1 kg,"The Extra long Premium basmati rice has a soft and fluffy texture on cooking
  with a pleasant aroma , delicious taste and distinct flavor"
392991,Sree Bell Sona Masuri Rice 10 kg,"Sonamasoori is comparitively low in calorie than
 long-grain or Basmati rice. It is also easy on digestive system
  and aids weight loss."
395229,INDIA GATE Select Premium Basmati Rice -5 Kg,"All Indian kitchens veg or non veg needs their secret ingredient to make the yummiest biryanis and pulavs and thats India Gate Basmati Rice. Its an aged rice when cooked comes out longer, softer and fluffier.
"
401675,Zeeba Tibar Basmati Rice 1 kg,Enjoy your biryanis and pulavs without the worry of gluten as Zeeba Tibar Basmati rice comes gluten-free. The best-flavored rice for your special occasions and regular consumption.
401677,Zeeba Tibar Basmati Rice 5 kg,Enjoy your biryanis and pulavs without the worry of gluten as Zeeba Tibar Basmati rice comes gluten-free. The best-flavored rice for your special occasions and regular consumption.
401683,Zeeba Dubar Basmati Rice Bag 5 kg Basmati Rice (Steam) 5 kg,
402729,"Pro Nature 100% Organic Sonamasoori Rice, 5kg","Sona Masoori raw rice, one of the best for daily consumption mostly grown in Karnataka and AP. Less in fat and sodium, and easy for bowel movement"
402730,"Pro Nature 100% Organic Sonamasoori Rice, 1kg","Sona Masoori raw rice, one of the best for daily consumption mostly grown in Karnataka and AP. Less in fat and sodium, and easy for bowel movement"
403545,"Kohinoor Dubar Authentic Basmati Rice, 1 kg Pack",Kohinoor Dubar Authentic Basmati Rice is the ultimate choice of everyone who loves to cook. This rice has aged naturally which adds to its flavor and taste. A must try for all foodies
343957,Sandwitch Bread 800 g,"Enjoy the yummy true sandwich bread slightly moist , with a medium crumb that is healthy and wholesome bread for all."
343964,Milk Bread 400 g,"Bread that is tender and Moist, with medium crust and the goodness of milk."
343971,Whole Wheat Bread 400g,Make your breakfast healthy and wholesome with Fresh and tasty whole wheat Bread
344099,Burger Bun 6 Pieces 70g,The best kind of bun for a burger made from best quality ingredients to make delicious burger that tastes unparalleled
344106,Pav Bun 200 g,Super soft and fresh Pav that will become your instant favorite and makes you want more
259985,"Britannia Bar Cake Gobbles Choco Chill, 120g","This Choco chill bar cake is super delicious, rich and melts in your mouth"
264427,"Winkies Cake - Chocolate Cake Slice, 130 g",Feel the richness and smoothness of chocolate with each bite of soft and delicious cake slices
281872,Britannia Yummy Fruity Fun Fruit Bar Cake 130 g,"Enjoy super delicious Cakes with fruity flavour that is 
  fresh and healthy ,"
334397,"Britannia Cake - Butter Blast, 55g Pack","With each bite feel the richness and smoothness of butter which
  gives mouth-watering flavour."
334398,Britannia Milky Masti Bar Cake 55g,"Soft and super delicious milk cake bars with the goodness of milk. 
 Enjoy the richness and smoothness of milky masti with each bite!"
334399,"Britannia Choco Chill Cake, 55g","Choco Chill Cakes are soft ,spongy and fluffy that deliciously
  melts in your mouth and made with fresh and healthy products."
334400,"Britannia Cake, Fruity Fun, 55 g","Enjoy super delicious Cakes with fruity flavour that is 
  fresh and healthy and melts in the mouth."
334401,"Britannia Cake, Pineapple Plunge, 55 g","Mouth Watering delicious Cakes with the punch of pineapple flavour that is 
  fresh and healthy ."
334402,"Britannia Cake - Orange Bites, 55 g Pouch","Orange Bites are soft ,delicious cake slices with the tangy orange flavour, healthy natural ingredients and mouth watering flavour."
336835,"Britannia Cake - Nuts and Raisin Romance, 160g Pack",Nuts and Raisins Romance Cake is a delicious blend of crunchiness and softness with a dash of tangy orange peel in every slice
