id,name,descriptions
392750,Kabuli Chana 1 kg,"Kabuli Chana helps to Control Blood Sugar Levels. Aids weight loss
 promotes digestion,helps to maintain healthy Heart 
 Prevent  Cancer and helps to maintain youthful appearance."
392751,Chana Brown Small (500 G),"Chana Brown  small is a rich source of vitamins like B6, C, folate,
 niacin, thiamin, riboflavin and several minerals like manganese, 
phosphorus, iron and copper. The incredible amount of nutrients
 in Brown Chana improves immunity, builds muscles , controls diabetes and promotes healthyhair, 
skin and nail ."
392752,Aro Urad Dal Whole 500 g,"Urad dal whole  is an excellant source of soluble and insoluble
 fiber,  which promotes digestion.It is  wealthy  in proteins, carbohydrates, vitamins and
 minerals.It maintains healthy heart and gives energy.It is 
ideal for diabetic patients."
392754,Patka Toor Dal 10 kg,"Patka Toor Dal  is an excellant source of protein, 
carbohydrates and fibre. Consuming this pulse daily will 
take care of everyday requirement of iron and calcium.
 Apart from these benefits, tur dal is a rich source of 
folic acids vital  for fetal growth and  helps to
prevent the birth defects of the new-born."
392755,Brown Chana Dal Small(1 kg),"Brown Chana dal small  is a rich source of vitamins like B6, C, folate,
 niacin, thiamin, riboflavin and several minerals like manganese, 
phosphorus, iron and copper. The incredible amount of nutrients
 in Brown Chana  dal improves immunity, builds muscles , controls diabetes and promotes healthyhair, 
skin and nail ."
392756,Aro Fried Gram 500 g,"Fried Gram Dal keeps the blood sugar levels and cholosterol
 under control.It also promotes bone health and brings down
 inflammation.Fried gram dal is good to maintain stable blood
 pressure and healthy heart.It promotes immunity and prevents
 cancer"
392757,Urad Dal 1 kg,"Urad dal is an excellant source of soluble and insoluble
 fiber,  which promotes digestion.It is  wealthy  in proteins, carbohydrates, vitamins and
 minerals.It maintains healthy heart and gives energy.It is 
ideal for diabetic patients."
392758,Chana Dal 500 Gm,"Chana Dal builds Strong Muscles and improves 
 immunity thereby Preventing Disease . 
It promotes healthy  Bones and Teeth keeps the
 Blood Sugar under check and helps in Weight Loss. 
It also Has Anti-Inflammatory Properties."
392759,Horse Gram 500 g,"Horse Gram is used in Traditional Medicine. It
improves the skin texture,is effective in checking blood sugar,
helps maintain healthy Weight ,effective in increasing fertility
among men,excellent for healthy liver and cures kidney stones."
392762,Green Moong Split 1 kg,"Moong Dal Split or Yellow gram is a rich in  protein and dietary fibre. It is low in 
fat and a good source of  B complex vitamins, calcium and potassium. 
Unlike other pulses it does not cause heaviness and flatulence. "
392763,Aro Green Moong Dal Whole 500 g,"Green Moong Dal is an excellant source of Vitamin A, B, C and E and also
  many other minerals including iron, calcium, and potassium. 
 It helps to reduce Weight as it is  considered heart friendly,
anti fungal anti bacterial and anti cancer.It is a protein rich
 low-fat food which contains plenty of fibre."
392764,Chana Dal 5 kg,"Chana Dal builds Strong Muscles and improves 
 immunity thereby Preventing Disease . 
It promotes healthy  Bones and Teeth keeps the
 Blood Sugar under check and helps in Weight Loss. 
It also Has Anti-Inflammatory Properties.
"
392765,Horse Gram 1 kg,"Horse Gram is used in Traditional Medicine. It 
improves the skin texture,is effective in checking blood sugar,
helps maintain healthy Weight ,effective in increasing fertility 
among men,excellent for healthy liver and cures kidney stones."
392767,Toor Dal 5 kg,"Toor Dal is an excellant source of protein, 
carbohydrates and fibre. Consuming this pulse daily will 
take care of everyday requirement of iron and calcium.
 Apart from these benefits, tur dal is a rich source of 
folic acids vital  for fetal growth and  helps to
prevent the birth defects of the new-born."
392768,Aro Moong Dal Split With Skin 1 kg,"The rich source of Folate in 
Moong Dal Split promotes Healthy Pregnancy.Folate is very important
 for the overall growth and development of your the foetus.
  200 gms cooked Moong Dal Split provides 80% of the required dietary intake(RDI)
 of folate ."
392771,Aro Red Rajma 1 kg,"Rajma is an incredible source of  Vitamin B9 
and should be included in the diet of pregnant women
 It is also a rich source  of phosphorus, calcium and 
magnesium which promoteshealthy  hair,skin and bone"
392772,Kabuli Chana 10 kg,
163575,"Lion Deseeded Dates - 100% Natural, 200 g Pouch","Dates are a really affordable snack that is packed with
  nutrition and energy in every bite.It is ideal for
  individuals of all ages."
163578,Lion Seeded Dates 500 g Refill (Buy 1 get 1 Free),"Dates is a perfect and healthy snack that nourishes your body.
 Moreover it is a healthy choice of snack that will keep your 
 tummy satisfied."
163582,"Lion Dates Arabian Deseeded, 500 g","Arabian Dates are very Nutritious and a good source of
 fibre.It is rich in antioxidants. It keeps your brain healthy
 and is a natural sweetener"
163584,Lion Desert King Seeded 500G Jar,"Dates has some amazing health benefits-improves digestive health,
 regulates bowel movements and prevents constipation,
 excellent source of iron and many other vitamins
 It is a perfect and healthy snack that nourishes your body."
325222,Lion Delicacy Dates 500 g,"Dates are very nutritious and a good source of
 fiber. It is rich in antioxidants. It keeps your brain healthy
 and is a natural sweetener.It is packed with
  nutrition and energy in every bite and is ideal for
  individuals of all ages."
380151,Pro Nature Organic Raw Peanuts (1 kg),"Peanuts are rich source of good fats
  protein, and fiber. They are an incredible source of
  potassium, phosphorous, magnesium, and B vitamins.
  Though peanuts are considerably high
  in calories, they are nutritious and have less 
 carbohydrates."
382050,Cashew 500 g,"Cashews are an excellent source of protein for vegetarians.
  that is low in sugar and rich in fiber.They are an excellent
  source of copper, magnesium, and manganese that improves 
 immunity,boosts energy, promotes heart,brain and bone health ."
384549,Melon Seeds 200g,"Watermelon seeds are a excellent of 
 nutrients like folate, iron, zinc, copper, magnesium,
  potassium. These seeds have anti bacterial properties
  They are very nutritious and boosts body metabolism
  because of the presence of amino acids, proteins and vitamin B 
 complex."
387480,Dry Dates 500G,"Dry Dates are a perfect and healthy snack that nourishes your body.It has some amazing health benefits-improves digestive health,
 regulates bowel movements and prevents constipation,
 excellent source of iron and many other vitamins."
388493,Regency Apricot - Turkel 200G,
388505,"Regency Almonds American, 250 g",Almonds are among the healthiest snack option as they contain fibre and healthy fats.almonds ensures that you get your daily dose of antioxidants to keep your body healthy.
388507,"Regency Pitted Prunes, Dried Plum, 240g","Prunes and dry plums are high in fiber and thus helps to maintain healthy digestive system. They are rich in iron, potassium and vitamins.It strengthens bones and builds muscles. Including prunes and dry plums in the diet lowers bad cholesterol and stabilizes blood pressure levels."
388509,Regency Cranberry Sliced 200G,"Cranberry is effective in maintaining youthful appearance.It promotes heart health and supports healthy
  digestive system.Regular intake of cranberry is beneficial to maintain post-menopausal health.It effectively treats or prevents infections in the urinary tract."
390131,Date Crown Buman Dates 500 G (Pack of 2),"Dates are soft and sweet.It is perfect and healthy snack that nourishes your body.
 Moreover it is a healthy choice of snack that will keep your 
 tummy satisfied."
390135,Date Crown Kheniji Dates 500 G,"Dates are very nutritious and a good source of
 fiber. It is rich in antioxidants. It keeps your brain healthy
 and is a natural sweetener.It is packed with
  nutrition and energy in every bite and is ideal for
  individuals of all ages."
390689,Regency Chia Seed(250G),"Chia seeds are one of the healthiest food with amazing benefits .
 They are packed with nutrients and contain less calories
 The presence of insoluble fiber keeps your tummy fuller for longer and promotes digestive health.
  They are excellent source of calcium,healthy fats, protein, and antioxidants."
391366,Almond 250 g,"Almonds promotes metabolism, digestive system, regulates blood sugar, blood pressure, Cholesterol Levels and prevents cancer."
391368,Raisin 250 g,"Raisins promote healthy heart ,stabilises 
  blood pressure and blood sugar. They contain fiber which 
 lowers bad cholesterol and thereby reduces the risk of strain 
  on the heart. Raisins are also an incredible source of 
 potassium."
392389,Regency Pumpkin Seeds 100G,"Pumpkin seeds are rich source of protein,magnesium and healthy fats, including omega-6 fatty acids that is good for vital organs of human body. They are full of vital nutrients and antioxidants that reduce the occurrence of cancer and also promote prostate and bladder health.It is high in fiber and lowers blood sugar levels"
392392,Regency Dry Apricot 250G,"Apricots are an incredible source of Vitamins A and E , fibers and minerals. They promote digestive and heart health.Dried apricots strengthens bones and nerve system as they are rich in calcium and magnesium."
392835,Peanut 1 kg,"Peanuts are rich source of good fats
  protein, and fiber. They are an incredible source of
  potassium, phosphorous, magnesium, and B vitamins."
392837,Peanut 500g,"Peanuts are considerably high in calories, but they are rich source of good fats,
  protein and fiber.They are nutritious and have less carbohydrates."
401672,Nutraj Gold Walnut Kernels 1 Kg,"Walnuts are power packed single-seed fruit that has good source of healthy fats, protein, copper, manganese, and 
 other vital nutrients required for our body.It helps to lower cholesterol levels,reduces inflammation, boosts immunity,aids weight loss,strengthens hair,and has anti ageing and cancer prevention properties."
413075,Hapillo Nuts And Berries 200G,"Nuts and Berries are among the healthiest food on the planet.They are loaded with antioxidants and are an incredible source of many nutrients and fiber.It helps to regulate blood sugar and improve response to insulin .It reduces inflammation,cholesterol levels and protects against cancer.It is good for healthy skin."
413076,Hapillo Trail Mix 200G,"Trail Mix is a perfect healthy snack.It is a great source of protein as it includes several high protein ingredients .It promotes muscle growth, tissue repair,immunity and much more. It aids weight loss by reducing your It gives a feeling of fullness and reduces appetite."
413079,Hapillo Kalmi Dates 250G,"Dates are very nutritious and a good source of
 fiber. It is rich in antioxidants. It keeps your brain healthy
 and is a natural sweetener.It is packed with
  nutrition and energy in every bite and is ideal for
  individuals of all ages."
413080,Hapillo Omani Dates 250G,"Dates are very nutritious and a good source of
 fiber. It is rich in antioxidants. It keeps your brain healthy
 and is a natural sweetener.It is packed with
  nutrition and energy in every bite and is ideal for
  individuals of all ages."
144126,"MTR Foods Spice Puliyogare Powder, 27g (pack of 10)",Puliyogare Powder is a blend of the natural spices to enhance the taste of your tradtional Tamarind rice preparation
174631,"MDH Turmeric Powder, 500 g","Turmeric has too many proven health benefits -
  improves immunity,heart health, prevents Alzheimer's disease and cancer. It' is anti-inflammatory and antioxidant. It may also helps to fight depression and arthritis."
174635,"MDH Lal Mirch, 500 g","Red Chillies are good source of Vitamin C that improves
  immune health and fights chronic diseases. It promotes heart
 health and contains antioxidants in red chilli that aids in 
 preventing blockages in blood vessels and arteries."
174636,"MDH Dhania Powder, 500 g","Coriander seeds are packed with key nutrients like vitamin C
 folic acid, vitamin A and beta-carotene.They aid production of
 digestive hormones, promotes liver health and reduces bad cholesterol."
206778,"Everest Tikhalal Chilli Powder, 500 g","Red Chillies are good source of Vitamin C that improves
  immune health and fights chronic diseases. It promotes heart
 health and contains antioxidants in red chilli that aids in 
 preventing blockages in blood vessels and arteries."
260767,MTR Bisibelabath Masala 100 g,"Bisi belabath powder is a super aromatic spice powder used to make 
  a popular meal made with rice ,dal and vegetables called bisibelebath from Karnataka."
260770,"MTR Rasam Powder, 200 g","Rasam powder is a flavourful and tasty mix made dals and spices. 
  to give a unique aroma and is also healthy."
260772,MTR Sambar Masala Powder 200 g,"Sambhar masala is a mix of spices in certain proportions.It is an important spice mix 
  in sambar recipe as well as many other recipes ."
260797,"MDH Chunky Chat Masala, 100 g","Chat masala is a blend of various Indian spices that is sprinkled to give that tangy taste for
  salads, on chaats, or even dals and curries."
260798,"MDH Chicken Masala, 100 g",Chicken Masala is a blend of premium quality spices in a certain proportion that is used to flavor the chicken with a predominant taste .
260799,"MDH Deggi Chilli, 100 g","Deggi Mirch is a special age old blend of special varieties of colourful Indian red chillies. 
 It is mildly spicy and gives a glowing natural red colour to the dish ."
260806,"MDH Kitchen King Mixed Spices Powder, 100 g","Mixed Spices Powder is a blend of unique spices in certain proportions which makes it convenient to use
 in recipes"
264515,Dabur Hommade Ginger Garlic Paste 100 g,"The proportion of ginger and garlic is perfect in Ginger Garlic Paste.Fresh ingredients are used making the texture grainy , exactly the way it is made at home .It contains no added colors or preservatives and is easy to use and tastes great with any recipe."
265317,"MDH Pav Bhaji Masala, 100 g","Pav bhaji masala is used in the preparation of Bhaji.It is a unique mix of spices added to mashed 
 vegetables to form a thick gravy served with bread or Pav.The proportion and combination of spices used in 
 Bhaji Masala Powder plays a huge role in making the masala unique from the other masala powders."
265490,Everest Turmeric Powder 500 g,"Turmeric has too many proven health benefits -
  improves immunity,heart health, prevents Alzheimer's disease and cancer. It' is anti-inflammatory and antioxidant. It may also helps to fight depression and arthritis."
265958,Mothers Recipe garlic Paste200 g,"Fresh ingredients are used in Garlic paste making the texture grainy , exactly the way it is made at home .It contains no added colors or preservatives and is easy to use and tastes great with any recipe."
265974,MTR Sambar Rice Ready To Eat 300 g,Super food ! So Natural and delicious! Daily meals that is easy to make and yummy to taste!
266031,MDH Kasoori Meethi 100 g,"Regular consumption of Kasuri Methi or fenugreek leaves regulates cholesterol levels and promotes digestive health .It stabilises the body's 
 blood lipids and checks the blood sugar levels."
266032,"MDH Garam Masala, 100 g","Garam masala is a unique blend of spices widely used in Indian cooking to give a special flavor to recipes. 
 Whole spices in certain proportion are dry roasted to release their aromatic flavors and then ground to 
 a fine powder."
266034,Everest Kasuri Methi 100 g,"Regular consumption of Kasuri Methi or fenugreek leaves regulates cholesterol levels and promotes digestive health .It stabilises the body's 
 blood lipids and checks the blood sugar levels."
266580,Everest Black Pepper Powder 100 g,"Pepper contains plenty of antioxidants that promotes health benefits like anti-inflammatory , 
 antibacterial and cancer fighting properties.It boosts brain function,checks blood sugar and 
 aids digestive health."
266585,Catch Chat Masala Powder 100 g,"Chat masala is a blend of various Indian spices that is sprinkled to give that tangy taste for
  salads, on chaats, or even dals and curries."
267979,MDH Cumin / Jeera Powder (100 g),"Jeera or Cumin is a rich source of potassium and iron which promotes immune health. 
 It contains incredible source of antioxidants ,prevents cancer ,cures diarrhea and regulates blood sugar · It is antibacterial and fights parasites."
267995,Everest Chicken Masala 100 g,Chicken Masala is a blend of premium quality spices in a certain proportion that is used to flavor the chicken with a predominant taste .
268002,Everest Chat Masala Powder 50 g,"Chat masala is a blend of various Indian spices that is sprinkled to give that tangy taste for
  salads, on chaats, or even dals and curries."
268005,"MTR Powder - Brinjal Rice/Vangi Bath, 100 g Pouch","Vangi bath powder is a unique blend of spices in definite proportion and combination to flavour
  sumptuous traditional meal of brinjal and rice."
268007,"MTR Spice Pav Bhaji Masala, 100 g","Pav bhaji masala is used in the preparation of Bhaji.It is a unique mix of spices added to mashed 
 vegetables to form a thick gravy served with bread or Pav.The proportion and combination of spices used in 
 Bhaji Masala Powder plays a huge role in making the masala unique from the other masala powders."
268008,Catch Black Pepper Powder 100 g,"Pepper contains plenty of antioxidants that promotes health benefits like anti-inflammatory , 
 antibacterial and cancer fighting properties.It boosts brain function,checks blood sugar and 
 aids digestive health."
268009,"MTR Spice Biryani Pulao Masala, 100 g","Biriyani Pulao Masala is a special blend of mild spices in definite proportion that is 
 used in very small quantity to add a subtle flavor to the cooked rice dish."
268010,Kwality Noodles Masala Powder 100 g,"Noodles masala is an unique blend of spices mixed in the
  right proportion to unlock the taste and aroma only when cooked."
268011,Catch Black Pepper Powder 50 g,"Pepper contains plenty of antioxidants that promotes health benefits like anti-inflammatory , 
 antibacterial and cancer fighting properties.It boosts brain function,checks blood sugar and 
 aids digestive health."
268012,Everest garam Masala Powder 50 g,"Garam masala is a unique blend of spices widely used in Indian cooking to give a special flavor to recipes. 
 Whole spices in certain proportion are dry roasted to release their aromatic flavors and then ground to 
 a fine powder."
268013,"MDH Turmeric Powder, 100 g","Turmeric has too many proven health benefits -
  improves immunity,heart health, prevents Alzheimer's disease and cancer. It' is anti-inflammatory and antioxidant. It may also helps to fight depression and arthritis."
268024,MDH Jal Jeera Powder 100 g,"Jaljeera powder is a combination of unique spices like chili ,cumin, ginger, black pepper, mint, black salt, 
 and even some citrus fruits or mango."
268025,Everest Super garam Masala Powder 200 g,"Garam masala is a unique blend of spices widely used in Indian cooking to give a special flavor to recipes. 
 Whole spices in certain proportion are dry roasted to release their aromatic flavors and then ground to 
 a fine powder."
268026,"MTR Masala - Puliogare Powder, 200 g Pouch",Puliyogare Powder is a blend of the natural spices to enhance the taste of your tradtional Tamarind rice preparation
268033,Everest Chicken Masala 200 g,Chicken Masala is a blend of premium quality spices in a certain proportion that is used to flavor the chicken with a predominant taste .
268035,MTR Puliogare Paste 200 g,Puliyogare Paste is a ready to use perfect blend of the natural spices to enhance the taste of your tradtional Tamarind rice preparation
268039,Everest Hing Powder 50 g,"Hing is rich in fiber and hence promotes digestive health and treats stomach problems like gastritis,
  bloating, abdominal pain and flatulence.It is also effective in treating Asthma ,regulates Blood Pressure ,
  treats Menstrual Pain and Headaches"
268041,SVT Hotel Special Asafoetida / Hing Compounded 250 g,"The compounded Hing gives a rich flavour to the recipes.Asafoetida/Hing promotes digestive health and treats stomach problems like gastritis,
  bloating, abdominal pain and flatulence.It is also effective in treating Asthma ,regulates Blood Pressure ,
  treats Menstrual Pain and Headaches"
268042,"MTR Cumin Powder, Pouch, 100 g","Jeera or Cumin is a rich source of potassium and iron which promotes immune health. 
 It contains incredible source of antioxidants ,prevents cancer ,cures diarrhea and regulates blood sugar · It is antibacterial and fights parasites."
268046,MTR Chutney Powder 200 g,"Chutney powder is an authentic blend of different spices in the right combination and proportion.
 It enchanting taste will spice up your breakfast dishes like Idli and Dosa."
268048,"Kwality Garam Masala, 100 g","Garam masala is a unique blend of spices widely used in Indian cooking to give a special flavor to recipes. 
 Whole spices in certain proportion are dry roasted to release their aromatic flavors and then ground to 
 a fine powder."
268059,"MTR Spice Black Pepper Powder, 50 g","Pepper contains plenty of antioxidants that promotes health benefits like anti-inflammatory , 
 antibacterial and cancer fighting properties.It boosts brain function,checks blood sugar and 
 aids digestive health."
268060,"Mother Recipe Ginger Garlic Paste, 100 g","Fresh ingredients are used in ginger garlic paste making the texture grainy , exactly the way it is made at home .It contains no added colors or preservatives and is easy to use and tastes great with any recipe."
268064,"Mother Recipe Garlic Paste, 100 g","Fresh ingredients are used in Garlic paste making the texture grainy , exactly the way it is made at home .It contains no added colors or preservatives and is easy to use and tastes great with any recipe."
268068,Everest Black Pepper Powder 50 g,"Pepper contains plenty of antioxidants that promotes health benefits like anti-inflammatory , 
 antibacterial and cancer fighting properties.It boosts brain function,checks blood sugar and 
 aids digestive health."
268071,Everest Punjab Chole Masala 50 g,"Chole masala is one of the most popular Indian dishes-Chickpeas cooked in a delicious and spicy gravy.
 Chole masala is a blend of unique spices in the right combination and proportion that can be made at home. 
 But these ready made chole masala not only tastes good but also saves a lot of time and effort."
268073,Everest Shahi Biryani Masala Powder 50 g,"Shahi Biriyani Masala Powder is a special blend of mild spices in definite proportion that is 
 used in very small quantity to add a subtle flavor to the cooked rice dish."
268074,Everest Meat Masala Powder 50 g,Meat Masala is a blend of premium quality spices in a certain proportion and combination that is used to flavor the meat with a predominant taste .
268076,Everest Chicken Masala 50 g,Chicken Masala is a blend of premium quality spices in a certain proportion that is used to flavor the chicken with a predominant taste .
268077,Everest Tandoori Chicken 100 g,"Tandoori chicken masala is a perfect blend of selected spices in the right combination and proportion
  to give rich flavour and superior aroma to the chicken preparation."
268078,Everest Chole Masala 100 g,"Chole masala is one of the most popular Indian dishes-Chickpeas cooked in a delicious and spicy gravy.
 Chole masala is a blend of unique spices in the right combination and proportion that can be made at home. 
 But these ready made chole masala not only tastes good but also saves a lot of time and effort."
268931,"MDH Chana Masala, 100 g","Chana masala is one of the most popular Indian dishes-Chickpeas cooked in a delicious and spicy gravy.
 Chana masala is a blend of unique spices in the right combination and proportion that can be made at home. 
 But these ready made chana masala not only tastes good but also saves a lot of time and effort."
268932,"MDH Meat Masala Powder, 100 g",Meat Masala is a blend of premium quality spices in a certain proportion and combination that is used to flavor the meat with a predominant taste .
268937,Everest Chat Masala Powder 100 g,"Chat masala is a blend of various Indian spices that is sprinkled to give that tangy taste for
  salads, on chaats, or even dals and curries."
268939,Everest Meat Masala Powder 100 g,Meat Masala is a blend of premium quality spices in a certain proportion and combination that is used to flavor the meat with a predominant taste .
268941,Everest Pav Bhaji Masala 100 g,"Pav bhaji masala is used in the preparation of Bhaji.It is a unique mix of spices added to mashed 
 vegetables to form a thick gravy served with bread or Pav.The proportion and combination of spices used in 
 Bhaji Masala Powder plays a huge role in making the masala unique from the other masala powders."
268942,Everest Kitchen King Masala 100 g,"Kitchen king masala is a blend of authentic spices in certain combination and proportions.It gives your dishes a new flavor and it is convenient to use
 in recipes"
268943,"Everest garam Masala,100 g","Garam masala is a unique blend of spices widely used in Indian cooking to give a special flavor to recipes. 
 Whole spices in certain proportion are dry roasted to release their aromatic flavors and then ground to 
 a fine powder."
